<?xml version="1.0"?>

<licenseSummary xmlns="http://mojo.codehaus.org/"
  xmlns:xsi="http://www.w3.org/2001/XMLSchema-instance"
  xsi:schemaLocation="http://mojo.codehaus.org/ licenses.xsd">
  <dependencies>
    <dependency>
      <groupId>org.codehaus.mojo</groupId>
      <artifactId>junk</artifactId>
      <version>1.1</version>
      <licenses>
        <license>
          <name>lgpl</name>
          <url>http://www.gnu.org/licenses/lgpl-3.0.txt</url>
        </license>
      </licenses>
    </dependency>
    
  </dependencies>
</licenseSummary>